{
  "version": "1.0",
  "object": "can",
  "frame": "world",
  "units": "meters",
  "start": [0.0, 0.0, 0.95],
  "goal": [0.0, 0.15, 0.95],
  "approach_height": 0.12,
  "events": [{"type": "grasp", "time": 2}, {"type": "transport", "time": 3}, {"type": "place", "time": 7}, {"type": "release", "time": 8}],
  "calibration": {"method": "operator_planar", "plane": "front", "workspace_span": 0.3, "roi": [0.67, 0.23, 0.17, 0.5]},
  "source": {"video": "fixture.mp4", "confidence": 0.75, "samples": 100}
}
